{"schemaVersion":"mkm-flight-distribution/1","product":"inspection-record","organizationId":"11111111-1111-4111-8111-111111111111","airportId":"22222222-2222-4222-8222-222222222222","stationAirport":"SHI","timezone":"Asia/Tokyo","releaseId":"0d286e84-69da-4ed5-b261-74ff38d6d2e7","dataVersion":1,"publishedAt":"2026-09-20T00:00:00.000Z","preview":true,"coverage":{"from":"2026-09-01","to":"2026-10-24"},"declaration":"schedules","flights":[{"id":"SYNTHETIC-SHI-BC101","flightNumber":"BC101","airlineCode":"BC","origin":"SHI","destination":"HND","journeyType":"domestic","validFrom":"2026-09-01","validTo":"2026-10-24","operatingDays":[1,2,3,4,5,6,7],"scheduledDeparture":"10:30","status":"NA","codeshareFlights":[]}]}
